{
  "black_run": false,
  "created_at_utc": "2026-05-04T00:00:00Z",
  "forbidden_authority_opened": {
    "brokerage_execution": false,
    "capital_deployment": false,
    "coefficient_modifier_authority_migration": false,
    "position_sizing": false,
    "review_explanation_runtime": false,
    "serial_candidate_selection_changes": false
  },
  "json_parse_status": "all_required_json_and_18_slices_parsed",
  "pytest_run": false,
  "read_ledger_summary": {
    "bytes_read_total": 36926063,
    "files_read_total": 117,
    "mandatory_missing": [],
    "optional_absent_total": 18,
    "records_total": 135,
    "repo_root": "/mnt/data/s7a_work/source/NVIDIA9_remotetest-main"
  },
  "record_reconciliation_summary": {
    "atlas_slice_files_observed": 18,
    "duplicate_selected_keys_removed_count": 0,
    "keyword_terms": [
      "parallel risk",
      "parallel_risk",
      "risk envelope",
      "independent risk",
      "arbiter",
      "caution",
      "block",
      "tight",
      "broad",
      "repricing",
      "volatility",
      "vix",
      "vvix",
      "rates",
      "fx",
      "breadth",
      "event shock",
      "risk packet"
    ],
    "manifest_slice_count_observed": 18,
    "manifest_total_records_observed": 1716,
    "selected_by_slice": {
      "dmpv3_packet_carriage": 8,
      "dynamic_coefficient_and_modifier_authority": 6,
      "exit_and_close_architecture": 1,
      "external_source_interfaces_and_api_ingress": 4,
      "opening_architecture_and_placement_readiness": 2,
      "parallel_risk_lane": 57,
      "persistence_ledgers_and_receipts": 2,
      "playbook_library_architecture": 1,
      "prepared_ingress_and_runtime_context_preparation": 6,
      "raw_capture_and_source_temporal_law": 2,
      "raw_signal_families": 18,
      "review_and_explanation_layer": 1,
      "serial_desk_cognition_spine": 2,
      "testing_proof_and_checkpoint_surfaces": 1
    },
    "selected_by_source": {
      "sequence1": 130,
      "sequence1_atlas_surface_slice": 111,
      "sequence3": 60,
      "sequence4": 5,
      "sequence5": 15,
      "sequence6": 15
    },
    "selected_record_count": 336,
    "selection_method": "deterministic scoped-field keyword + mandatory slice/routing rules from Sequence 7 worker brief; tests-first only, runtime not implemented",
    "sequence1_record_count_observed": 1716,
    "sequence1_route_authority_only": true,
    "sequence7a_disposition": "tests_first_authority_opened_no_runtime_implementation",
    "unassigned_selected_records_count": 0
  },
  "records": [
    {
      "reasons": [
        "sequence1_scoped_field_keyword_match_parallel_risk_envelope_authority"
      ],
      "record_id": "atlas_donor_dmp_envelope_002",
      "slice_name": "dmpv3_packet_carriage",
      "source": "sequence1_atlas_surface_slice",
      "source_file": "var/audit/atlas_surface_slices/slices/dmpv3_packet_carriage.json"
    },
    {
      "reasons": [
        "sequence1_scoped_field_keyword_match_parallel_risk_envelope_authority"
      ],
      "record_id": "atlas_donor_dmp_envelope_006",
      "slice_name": "dmpv3_packet_carriage",
      "source": "sequence1_atlas_surface_slice",
      "source_file": "var/audit/atlas_surface_slices/slices/dmpv3_packet_carriage.json"
    },
    {
      "reasons": [
        "sequence1_scoped_field_keyword_match_parallel_risk_envelope_authority"
      ],
      "record_id": "atlas_donor_parallel_risk_001",
      "slice_name": "dmpv3_packet_carriage",
      "source": "sequence1_atlas_surface_slice",
      "source_file": "var/audit/atlas_surface_slices/slices/dmpv3_packet_carriage.json"
    },
    {
      "reasons": [
        "sequence1_scoped_field_keyword_match_parallel_risk_envelope_authority"
      ],
      "record_id": "atlas_donor_parallel_risk_013",
      "slice_name": "dmpv3_packet_carriage",
      "source": "sequence1_atlas_surface_slice",
      "source_file": "var/audit/atlas_surface_slices/slices/dmpv3_packet_carriage.json"
    },
    {
      "reasons": [
        "sequence1_scoped_field_keyword_match_parallel_risk_envelope_authority"
      ],
      "record_id": "atlas_donor_parallel_risk_018",
      "slice_name": "dmpv3_packet_carriage",
      "source": "sequence1_atlas_surface_slice",
      "source_file": "var/audit/atlas_surface_slices/slices/dmpv3_packet_carriage.json"
    },
    {
      "reasons": [
        "sequence1_scoped_field_keyword_match_parallel_risk_envelope_authority"
      ],
      "record_id": "atlas_donor_parallel_risk_020",
      "slice_name": "dmpv3_packet_carriage",
      "source": "sequence1_atlas_surface_slice",
      "source_file": "var/audit/atlas_surface_slices/slices/dmpv3_packet_carriage.json"
    },
    {
      "reasons": [
        "sequence1_scoped_field_keyword_match_parallel_risk_envelope_authority"
      ],
      "record_id": "atlas_donor_service_carry_handoff_004",
      "slice_name": "dmpv3_packet_carriage",
      "source": "sequence1_atlas_surface_slice",
      "source_file": "var/audit/atlas_surface_slices/slices/dmpv3_packet_carriage.json"
    },
    {
      "reasons": [
        "sequence1_scoped_field_keyword_match_parallel_risk_envelope_authority"
      ],
      "record_id": "atlas_donor_cognition_runtime_service_011",
      "slice_name": "dmpv3_packet_carriage",
      "source": "sequence1_atlas_surface_slice",
      "source_file": "var/audit/atlas_surface_slices/slices/dmpv3_packet_carriage.json"
    },
    {
      "reasons": [
        "sequence1_scoped_field_keyword_match_parallel_risk_envelope_authority"
      ],
      "record_id": "atlas_donor_calibration_012",
      "slice_name": "dynamic_coefficient_and_modifier_authority",
      "source": "sequence1_atlas_surface_slice",
      "source_file": "var/audit/atlas_surface_slices/slices/dynamic_coefficient_and_modifier_authority.json"
    },
    {
      "reasons": [
        "sequence1_scoped_field_keyword_match_parallel_risk_envelope_authority"
      ],
      "record_id": "atlas_donor_calibration_037",
      "slice_name": "dynamic_coefficient_and_modifier_authority",
      "source": "sequence1_atlas_surface_slice",
      "source_file": "var/audit/atlas_surface_slices/slices/dynamic_coefficient_and_modifier_authority.json"
    },
    {
      "reasons": [
        "sequence1_scoped_field_keyword_match_parallel_risk_envelope_authority"
      ],
      "record_id": "atlas_donor_state_policy_037",
      "slice_name": "dynamic_coefficient_and_modifier_authority",
      "source": "sequence1_atlas_surface_slice",
      "source_file": "var/audit/atlas_surface_slices/slices/dynamic_coefficient_and_modifier_authority.json"
    },
    {
      "reasons": [
        "sequence1_scoped_field_keyword_match_parallel_risk_envelope_authority"
      ],
      "record_id": "atlas_donor_service_config_surface_015",
      "slice_name": "dynamic_coefficient_and_modifier_authority",
      "source": "sequence1_atlas_surface_slice",
      "source_file": "var/audit/atlas_surface_slices/slices/dynamic_coefficient_and_modifier_authority.json"
    },
    {
      "reasons": [
        "sequence1_scoped_field_keyword_match_parallel_risk_envelope_authority"
      ],
      "record_id": "atlas_donor_state_conditioned_modifier_service_015",
      "slice_name": "dynamic_coefficient_and_modifier_authority",
      "source": "sequence1_atlas_surface_slice",
      "source_file": "var/audit/atlas_surface_slices/slices/dynamic_coefficient_and_modifier_authority.json"
    },
    {
      "reasons": [
        "sequence1_scoped_field_keyword_match_parallel_risk_envelope_authority"
      ],
      "record_id": "atlas_donor_state_conditioned_modifier_service_016",
      "slice_name": "dynamic_coefficient_and_modifier_authority",
      "source": "sequence1_atlas_surface_slice",
      "source_file": "var/audit/atlas_surface_slices/slices/dynamic_coefficient_and_modifier_authority.json"
    },
    {
      "reasons": [
        "sequence1_scoped_field_keyword_match_parallel_risk_envelope_authority"
      ],
      "record_id": "atlas_donor_module_004",
      "slice_name": "exit_and_close_architecture",
      "source": "sequence1_atlas_surface_slice",
      "source_file": "var/audit/atlas_surface_slices/slices/exit_and_close_architecture.json"
    },
    {
      "reasons": [
        "sequence1_scoped_field_keyword_match_parallel_risk_envelope_authority"
      ],
      "record_id": "atlas_donor_imported_ladder_readiness_003",
      "slice_name": "external_source_interfaces_and_api_ingress",
      "source": "sequence1_atlas_surface_slice",
      "source_file": "var/audit/atlas_surface_slices/slices/external_source_interfaces_and_api_ingress.json"
    },
    {
      "reasons": [
        "sequence1_scoped_field_keyword_match_parallel_risk_envelope_authority"
      ],
      "record_id": "atlas_donor_service_capital_allocator_007",
      "slice_name": "external_source_interfaces_and_api_ingress",
      "source": "sequence1_atlas_surface_slice",
      "source_file": "var/audit/atlas_surface_slices/slices/external_source_interfaces_and_api_ingress.json"
    },
    {
      "reasons": [
        "sequence1_scoped_field_keyword_match_parallel_risk_envelope_authority"
      ],
      "record_id": "atlas_donor_api_app_050",
      "slice_name": "external_source_interfaces_and_api_ingress",
      "source": "sequence1_atlas_surface_slice",
      "source_file": "var/audit/atlas_surface_slices/slices/external_source_interfaces_and_api_ingress.json"
    },
    {
      "reasons": [
        "sequence1_scoped_field_keyword_match_parallel_risk_envelope_authority"
      ],
      "record_id": "atlas_donor_api_app_051",
      "slice_name": "external_source_interfaces_and_api_ingress",
      "source": "sequence1_atlas_surface_slice",
      "source_file": "var/audit/atlas_surface_slices/slices/external_source_interfaces_and_api_ingress.json"
    },
    {
      "reasons": [
        "sequence1_scoped_field_keyword_match_parallel_risk_envelope_authority"
      ],
      "record_id": "atlas_donor_execution_records_012",